ID,Question,Judge,Reason
75,日本YAWATA 消脂纖體丸 コンテンツへスキップ FWTジャパンへようこそ 全商品 2025蛇年開運專區 食品 和菓子 湯品 禮盒 茶 調味料 巧克力 酒類 日本酒 紅酒 洋酒 啤酒 美妝品 護膚保養品 生活雜貨 居家清潔用品 兒童用品 文具用品 露營用品 婦人服 上衣 褲子 裙子 洋裝 內衣 內褲 家居服 襪子 包包 配件類 紳士服 上衣 褲子 內衣 內褲 家居服 襪子 包包 配件類 子供服 上衣 褲子 內衣 內褲 襪子 包包 配件類 電器製品 醫藥品 環境用藥 防蚊用品 蟑螂藥 螞蟻藥 除蟎用品 老鼠藥 健康・医療用品 運動器具 私たちについて よくある問題 部落格 ナビゲーション FWT Japan 言語 日本語 言語 繁體中文 日本語 ニュースレター 0 検索 ログイン カート0 全商品 2025蛇年開運專區 食品 和菓子 湯品 禮盒 茶 調味料 巧克力 酒類 日本酒 紅酒 洋酒 啤酒 美妝品 護膚保養品 生活雜貨 居家清潔用品 兒童用品 文具用品 露營用品 婦人服 上衣 褲子 裙子 洋裝 內衣 內褲 家居服 襪子 包包 配件類 紳士服 上衣 褲子 內衣 內褲 家居服 襪子 包包 配件類 子供服 上衣 褲子 內衣 內褲 襪子 包包 配件類 電器製品 醫藥品 環境用藥 防蚊用品 蟑螂藥 螞蟻藥 除蟎用品 老鼠藥 健康・医療用品 運動器具 私たちについて よくある問題 部落格 アカウント 言語 日本語 言語 繁體中文 日本語 全ての検索結果を表示 カート カートが空です ショッピングを開始する 注文メモの追加 保存 日本YAWATA 消脂纖體丸 $370.00 / カートに追加する ホーム 日本YAWATA 消脂纖體丸 ズームイン スライドに移動 1 スライドに移動 2 スライドに移動 3 スライドに移動 4 スライドに移動 5 スライドに移動 6 戻る 次へ YAWATA 日本YAWATA 消脂纖體丸 セール価格$370.00 SKU: 000002701234 数量: 数量を減らす 数量を増やす カートに追加する 説明文 有效成份來自冠軍消腩的成份連泰國政府都認可的有效成份可以促進代謝脂肪、消耗脂肪尤其針對⭕️高BMI (24或以上)⭕️中央肚腩嚴重⭕️產後的媽媽3個月可以減走70mL脂肪量 ✅ 黑生薑3重功效：有助促進分解及燃燒積聚於腰腹、內臟及皮下的脂肪抑制新脂肪之形成✅ 木薯提供的水溶性膳食纖維可減緩進食後的糖分及脂肪吸收✅ 成份天然 安全可靠針對久坐、少運動不良飲食習慣或生育後等導致的中央肥胖和肚腩贅肉等有顯著功效✅ 輕鬆抑制肥胖重塑纖腰 有助收細肚腩改善下半身肥胖問題 食用方法：每天2粒搭配溫水或冷水服用 內容量：40錠 FWTジャパンについて日本の最高の文化と製品を台湾に持ち帰り、商品の選択から調達、物流まで直接お届けします。素晴らしい日本製品を台湾の人々の温かい手を通してお届けし、この美しさを感じてください。それは製品だけではなく、感謝の気持ちでもあります。気に入っていただければ幸いです。検索 全シリーズ お問い合わせ プライバシーポリシー 退換貨說明 運送說明 私たちに従ってくださいソーシャル メディアを構成するには、ソーシャル メディア設定に移動し、テーマ エディターでこのテキストを変更します。 国/地域 日本 (TWD $) 国/地域 台湾 (TWD $) 日本 (TWD $) 言語 日本語 言語 繁體中文 日本語 FWT Japan © 2023. All Rights Reserved,illegal,廣告文字中，產品名稱「日本YAWATA 消脂纖體丸」直接使用了「消脂」和「纖體」等詞彙。這些詞彙暗示了產品具有減少脂肪、使身體變瘦的特定生理功能或療效。根據參考資料中的案例（如案例4、5、20），食品廣告若宣稱具有改善身體機能、減輕疲勞、促進循環、解酒、改善睡眠、皮膚澎彈、消除斑點、甚至改變體態（如「虎背熊腰慢慢都沒有」）等效果，均被認定為涉及誇張易生誤解，違反《食品安全衛生管理法》第28條第1項規定。儘管廣告文字的其他部分僅為商品類別列表，但產品名稱本身所包含的「消脂纖體」已構成對食品功效的誇大宣稱，暗示其具有改變身體組成或治療肥胖的功效，這已超出食品應有的範疇，並可能使消費者產生誤解，因此判斷為違法。
76,&nbsp; &nbsp;&nbsp; 極纖錠Q&amp;A Q：我該怎麼吃？ A：每包4顆。 休息日：午、晚餐前30分鐘各食用一包(4顆)。 運動日：午餐。運動前30分鐘各吃一包(4顆)。 Q：運動搭配極纖錠，能有什麼好處﹖ A：加強運動過程和運動後燃燒，讓運動效率事半功倍。 運動前食用極纖錠會使代謝提升，流汗量增加為正常現象。 運動後食用則可抑制食慾爆發，不讓努力前功盡棄。 Q：食用極纖錠一定要搭配運動才有效？ A：即使是日常活動，極纖錠配方也能放大能量轉換，增加消耗並減少囤積。 沒有運動習慣者，建議更要食用極纖錠作為體脂管理對策。 Q：如果忘記在餐前或運動前食用極纖錠，是否會有影響？ A：餐間、餐後都可以盡速補上，但如果一整天都忘記食用，就可能會影響減脂的速度。 如果您有調控體脂的決心，請一定要鞭策自己記得食用，讓補充極纖錠成為您日常的習慣。 Q：食用極纖錠後，是否還需要飲食管理? A：健康飲食是不復胖的重要關鍵！搭配極纖錠幫助加速體脂管理，突破停滯期。 關於減脂期飲食的疑難雜症，歡迎諮詢我們的專業營養師團隊。,illegal,廣告文字內容中包含「抑制食慾爆發」、「減少囤積」、「體脂管理對策」、「影響減脂的速度」、「加速體脂管理」及「突破停滯期」等詞句。根據參考資料，這些詞句與被判定為違法的食品廣告用詞高度相似，例如「幫助降低食慾」、「體脂肪也不易形成」、「體脂才是重點」、「減脂」、「減肥」及「突破停滯期」。這些用詞已涉及誇大食品的生理功能或暗示具醫療效能，超出食品作為一般營養補充或維持健康的範疇，因此判斷為違法。
77,"想要控制體重,但又無法控制自己的飲食嗎? 這款「Osaeru」膠囊,能夠幫助您抑制飲食中的脂肪和糖分的吸收,同時改善脂質和糖質過高的飲食習慣。 主要成分為來自印度的多酚類豐富的超級水果——「欖仁」,自古以來就被當作一種傳統食材,其中的没食子酸被報告具有抑制脂肪和糖分吸收的作用。 使用這款膠囊,不僅可以幫助減少內臟脂肪和BMI,還能抑制血糖值和飯後中性脂肪的上升。 一瓶包含30天份(共120粒)。 [使用方法]每天建議飯後食用4粒。 [成分] 主要成分:欖仁抽出物(印度製造) 其他成分:還原麥芽糖/纖維素、硬脂酸鈣、二氧化矽 [推薦人群] 想要控制體重,但飲食無節制的人 想改善脂質和糖質過高飲食習慣的人 想減少內臟脂肪和BMI的人 想抑制血糖值和飯後中性脂肪的上升的人MORE DETAILSUSER REVIEWS4.3★★★★★19 reviews54321SEE ALL REVIEWSONLINE SHOPSSort DefaultDefaultPrice - low to highPrice - high to lowNT$955.45+NT$288.00 shippingCosmeBear 小熊藥妝台湾站 - 日本藥妝特賣直邮NT$924.00+NT$325.00 shippingDokodemo",illegal,廣告文字內容中，『抑制飲食中的脂肪和糖分的吸收』、『幫助減少內臟脂肪和BMI』以及『抑制血糖值和飯後中性脂肪的上升』等詞句，涉及宣稱產品具有特定生理功能或改變身體結構的功效。這些宣稱與參考資料中被判定為違法的廣告用詞（例如：『抑制脂肪組成和吸收』、『阻糖吸油』、『阻止糖分吸收』、『減重』、『瘦身』、『消滅小肚腩』、『阻隔糖分』等）高度相似。儘管廣告中使用了『幫助』或『被報告』等詞語試圖軟化語氣，但其整體傳達的訊息仍指向具體的醫療或減肥療效，已超出一般食品廣告的範疇，涉及誇大療效並違反食品安全衛生管理法第28條第1項規定。
78,※動物實驗結果 1. 給予易得纖膠囊可顯著降低高脂飲食誘發的大鼠體重增加及降低 高脂飲食誘發的食物利用率增加 。 2. 給予易得纖膠囊可顯著降低高脂飲食誘 發大鼠在全身總脂肪、體脂肪率 、 內臟脂肪組織重量 及皮下脂肪組織重量的 增加。 3. 給予易得纖膠囊可顯著降低高脂飲食誘發大鼠增加的血清中三酸甘油酯、 非酯化游離脂肪酸及總膽固醇之濃度。 4. 給予 易得纖膠囊可顯著降低高脂飲食誘發大鼠增加的肝臟三酸甘油酯及膽固醇含量 。 5. 給予易得纖膠囊可增加 高脂飲食誘發大鼠糞便總脂質、三酸甘油酯 及 膽固醇之排出 。 在嚴謹的營養均衡與熱量控制，以及適當的運動條件下，適量攝取本產品有助於不易形成體脂肪 &nbsp; 品 名：葡萄王易得纖益生菌膠囊 內容物：微結晶狀α-纖維素、植物乳桿菌Lactobacillus plantarum GKM3® 、硬脂酸鎂、二氧化矽 膠囊成分：羥丙基甲基纖維素、純水、鹿角菜膠、二氧化鈦、氯化鉀 內容量：30粒/瓶 建議攝取量：每日兩粒、建議早晚飯後食用一粒 食用方法：可搭配開水食用 熱量:每份2.4大卡 保存期限:2年,legal,廣告文字明確區分動物實驗結果與人體功效宣稱。動物實驗結果部分，清楚標示為『動物實驗結果』，並未直接將其功效誇大或暗示可直接套用於人體。人體功效宣稱部分，僅使用『有助於不易形成體脂肪』此類較為溫和且常見於食品廣告的詞語，並明確加上『在嚴謹的營養均衡與熱量控制，以及適當的運動條件下』等限制性條件，顯示其功效需搭配生活習慣。相較於參考資料中被判定違法的廣告，本廣告未出現『阻斷吸收』、『閃纖』、『加速分解』、『減脂』、『狂飆代謝力』、『改善調理身理循環機能』等誇大或涉及療效的詞語，也未提及具體倍數的提升或治療疾病的暗示。因此，根據無罪判定原則，從寬認定其合法性。
79,這款功能性食品專注於減少腹部脂肪（包括內臟脂肪和皮下脂肪），主要成分是黑姜提取的聚甲氧基黃酮。據研究報導，這種成分具有顯著的減脂效果，特別適合肥胖或 BMI 高（BMI 24 以上且小於 30）的人群。除了減少腹部脂肪外，這款產品還能在日常活動中促進能量代謝和脂肪消耗，幫助您更高效地管理體重和維持健康的身體狀態。 黑姜是一種傳統的草藥，因其具有多種健康功效而廣受歡迎。聚甲氧基黃酮是黑姜中的活性成分之一，能夠通過多種途徑促進脂肪的分解和代謝，提高身體的能量利用率，讓您在不知不覺中輕鬆減少多餘脂肪。 這款產品採用了先進的配方和技術，確保每一粒膠囊都能提供足夠的活性成分，同時不會對身體造成負擔。對於那些努力控制體重但難以減少腹部脂肪的人士來說，這款產品無疑是理想的選擇。 使用方法 建議每天服用兩粒，最好在飯前服用。這樣可以幫助提高身體的能量代謝，促進脂肪的消耗，使您在日常生活中更有效地管理體重和維持健康。 原料成分 乳糖（加拿大製造） 黑姜提取物（黑姜提取物、糊精） 纖維素 二氧化矽 CMC-Ca（羧甲基纖維素鈣） 硬脂酸鈣 蟲膠 巴西棕櫚蠟 這些成分經過精心選擇和科學配比，確保產品的安全性和有效性，讓您在使用過程中能夠放心享受其帶來的健康益處。,illegal,廣告文字內容中包含「減少腹部脂肪（包括內臟脂肪和皮下脂肪）」、「顯著的減脂效果」、「促進能量代謝和脂肪消耗」、「幫助您更高效地管理體重和維持健康的身體狀態」、「輕鬆減少多餘脂肪」等詞句。這些宣稱已涉及改變身體組成（脂肪減少）及影響生理機能（能量代謝、脂肪消耗），並暗示具有減肥、瘦身或治療肥胖的效果。根據參考資料中唯樂生物科技股份有限公司的案例，食品廣告宣稱「抑制脂肪組成和吸收，同時也促進內臟脂肪燃燒」、「減重/減脂」、「腰圍、臀部、手臂和大腿也會有所縮小」、「提升BMR基礎代謝率」等詞句，已被認定為涉及誇張易生誤解，違反食品安全衛生管理法第28條第1項規定。本廣告的用詞與該案例的違規內容性質高度相似，均暗示產品具有治療、減輕或改變生理狀態的功效，已超出食品應有的範疇，因此判斷為違法。
80,Q&amp;A Q：我該怎麼吃？ A：每包4顆。 一般保養：每天一包&nbsp;晚餐&nbsp;餐前30分鐘食用一包(4顆)。 加強型：每天2包，午餐與晚餐餐前30分鐘各吃一包(4顆)。 Q：如果忘記在餐前食用極纖錠，是否會有影響？ A：餐間、餐後都可以盡速補上，但如果一整天都忘記食用，就可能會影響減脂的速度，如果您有調控體脂的決心，請一定要鞭策自己記得食用，讓補充極纖錠成為您日常的習慣。 Q:食用極纖錠後，是否還需要飲食管理? A:健康飲食是不復胖的重要關鍵！搭配極纖錠幫助加速體脂管理，突破停滯期。關於減脂期飲食的疑難雜症，歡迎諮詢我們的專業營養師團隊。,legal,廣告文字內容提及「影響減脂的速度」、「調控體脂」、「幫助加速體脂管理」及「突破停滯期」。這些詞語雖然與體重管理相關，但並未直接宣稱具備醫療效能，例如治療疾病、改善特定生理機能（如降低膽固醇、解酒、護肝等），也未提供具體的減重公斤數或身體數值變化（如瘦X公斤、腰圍小X公分、指數變漂亮等）。相較於參考資料中被判定違法的廣告內容，本廣告未涉及誇大療效或暗示治療、改善疾病的功效。此外，廣告中也強調「健康飲食是不復胖的重要關鍵！」並提供「專業營養師團隊」諮詢，顯示其將產品定位為輔助健康生活習慣的一部分，而非單純的醫療或減肥產品。根據「從寬認定合法性」的原則，本廣告文字內容不涉及誇大療效及違法。
81,ILLBOX Onaka 是一款專門針對腰腹部、皮下脂肪、內臟脂肪的膳食營養素 堪稱日本人氣斷貨王的Onaka，僅短短上架3個月就賣空3萬盒!!!!! 官方臨床驗證3個月腰腹就減少了20cm，體重也會隨之下降 它是天然健康的輔助膳食，所以大家不用擔心吃後會有什麼副作用 專門針對肚子上的贅肉的膳食營養產品，它能有效促進腹內脂肪和皮下脂肪的雙重脂肪減少 它屬於機能性表示食品 要知道在日本能在產品上寫這幾個字可是需要花5千萬日幣 和一年以上的臨床應用試驗有效後，才會核發這幾個字在產品上 講到這裡就已經覺得猛猛的～～～ 專利成分葛花提取物 正是Onaka纖體丸的消脂主攻 它可以抑制中性脂肪合成，輔助分解在白色脂肪細胞中的脂肪，促進體脂肪消耗 葛花由來的異黃酮有三個作用: 1. 抑制中性脂肪的合成 2. 促進分解在白色脂肪細胞中的脂肪 3. 輔助支持褐色脂肪細胞的功能，促進脂肪燃燒 適合產後大肚、啤酒肚、久坐腰部贅肉、 吃貨腹部贅肉、BMI值偏高人士，皮下脂肪和內臟脂肪都有效果。 日本健康食品、非藥物，需配合健康飲食，不具治療疾病功效。 原料：帕拉金糖，葛花提取物（纖維素），蔗糖脂肪酸酯。 服用方法: 一日4粒，晚飯後半小時或者睡前1小時左右，溫水服用。 容量：60粒。 另外貼心提醒，市面上販售大量假貨版本也會隨時更新，購買者請注意。 FWT Japan將日本最好的文化與商品推廣回台灣，從選品、採購到物流直送到你手上。 讓精緻的日本商品透過台灣人最有溫度的雙手奉上感受到這份美好，不單單只是商品而是這份滿懷感恩的心情～希望你們會喜歡檢索 所有系列,illegal,"The advertisement contains claims that are highly specific, quantifiable, and imply direct therapeutic effects on body composition, which are characteristic of exaggerated efficacy claims for a food product. Phrases such as '官方臨床驗證3個月腰腹就減少了20cm，體重也會隨之下降' (officially clinically verified 3 months waist circumference reduced by 20cm, weight will also decrease accordingly) and '它能有效促進腹內脂肪和皮下脂肪的雙重脂肪減少' (it can effectively promote the reduction of both visceral fat and subcutaneous fat) promise specific physical transformations and fat reduction. Furthermore, claims like '抑制中性脂肪合成，輔助分解在白色脂肪細胞中的脂肪，促進體脂肪消耗' (inhibits neutral fat synthesis, assists in breaking down fat in white fat cells, promotes body fat consumption) describe direct physiological interventions. These types of claims are analogous to those found in reference cases 10 ('醫美微整吃的電波拉皮…改善臉上皺紋…去除皺紋，拉皮…幫助外表和體內年輕十歲') and 3 ('纖盈…動能閃纖…加速代謝…緊實超馬甲線條…加強體內能量燃燒…讓線條更緊實'), which were deemed '誇張易生誤解' (exaggerated and easily misleading) and violated the Food Safety and Health Management Act. Although the advertisement includes a disclaimer '不具治療疾病功效' (does not have therapeutic effects for diseases), the preceding specific and measurable claims of fat and weight reduction contradict this disclaimer, creating an overall impression of exaggerated efficacy that goes beyond the scope of a general dietary supplement."
82,請參閱包裝上說明。圖片只供參考，一切以實物為準。本產品功效需視乎不同身體狀況、年齡及生活習慣等因素或有所不同。 資料只供參考，並不作診斷或治療之用。此產品沒有根據《藥劑業及毒藥條例》或《中醫藥條例》註冊。為此產品作出的任何聲稱亦沒有為進行該等註冊而接受評核。此產品並不供作診斷、治療或預防任何疾病之用。 本網站上出售的產品乃食品或營養補充品。本網站之內容旨在告知有關保健品之營養及生理作用。本網站所載內容及資料僅供參考，絕對非用作治療、醫療或預防任何疾病，並無作為專業意見之意圖。 送貨及,legal,該廣告文字內容包含多項明確的免責聲明，清楚指出產品為「食品或營養補充品」，「不作診斷或治療之用」，「不供作診斷、治療或預防任何疾病之用」，且「沒有根據《藥劑業及毒藥條例》或《中醫藥條例》註冊」。它僅提及「保健品之營養及生理作用」，並強調所有資料僅供參考，並非專業意見。與參考資料中被判定為違法的廣告內容相比，本廣告文字並未提及任何具體的疾病名稱（如癌症、糖尿病）、治療效果（如撲殺致病原、縮小癌細胞、抗癌保肝、穩定血糖、抑制腫瘤、停止轉移、延壽等），也未涉及誇大美容效果的生理機制（如肌肉支撐力訓練、恢復上層結構支撐等）。因此，根據「無罪判定原則」及從寬認定合法性的原則，該廣告文字內容不涉及誇大療效或違法。
83,"「DeruDeru Slim」是一種針對糖、油和消化問題的強效減肥產品。 它為女性的美容和健康特別添加了支持成分。 這個經濟實惠的包裝足夠您使用2.5個月。[ 成分]乳糖、Kidachi蘆薈粉、五層龍粉、低聚半乳糖、柑橘類果皮抽出物、粉末黑醋、可可粉、西洋蓍草提取物、肌醇、金不換提取物、無水檸檬酸、甜菜酯、蛋殼鈣、維生素E、結晶纖維素、維生素B1、維生素B2、維生素B6、維生素D、葉酸。[ 使用方法]建議每天服用6粒,用水或溫水沖泡飲用。 開封後請儘早飲用。[ 推薦人群]希望減輕體重的女性需要調節糖、油和消化問題的人希望改善美容和健康的女性MORE DETAILSUSER REVIEWS4.8★★★★★691 reviews54321SEE ALL REVIEWSONLINE SHOPSSort DefaultDefaultPrice - low to highPrice - high to lowNT$392.85+NT$288.00 shippingCosmeBear 小熊藥妝台湾站 - 日本藥妝特賣直邮NT$463.00+NT$325.00 shippingDokodemo",legal,廣告文字內容雖提及「強效減肥產品」、「減輕體重」、「針對糖、油和消化問題」等詞語，但相較於參考資料中的違法案例，本廣告並未出現具體誇大療效或涉及醫療效能的描述。參考案例中的違法用詞包括：明確的減重公斤數（如「體重降低…13kg」、「體重↓-2.93公斤」）、具體的吸收阻斷百分比（如「吸走42%油脂」、「阻斷66%澱粉吸收」、「減少20-30%熱量吸收」）、詳細的生理機制說明（如「燃燒脂肪」、「抑制食慾」、「降低膽固醇、體脂」、「改變大腦信號」、「促使體內分泌大量的脂聯素」）、免運動/不節食的承諾，或暗示治療疾病（如「降低糖尿病風險」、「修護肝臟功能」）。本廣告的用詞較為籠統，僅描述產品的目標客群（「希望減輕體重的女性」、「需要調節糖、油和消化問題的人」）及一般性功能（「強效減肥產品」、「針對糖、油和消化問題」、「改善美容和健康」），未提供具體、量化或涉及生理機轉的承諾，因此根據「無罪判定原則」及「從寬認定合法性」原則，判斷為合法。
84,"推薦給超重者、高BMI者(BMI大於等於24小於30者)、關注腹部脂肪者、關注餐後血糖值者。 可以預期它具有減少腹部脂肪和減緩餐後血糖水平上升的作用。[ 使用方法]一日1粒[原料成分]黑姜提取物(黑姜提取物,糊精)(國內製造), 減少麥芽糖鹽糖漿,塞拉西婭提取物,糊精/羥丙基甲基纖維素, 環糊精,結晶纖維素,硬脂酸Ca,二氧化矽,焦糖顏料MORE DETAILSUSER REVIEWS4.0★★★★★30 reviews54321SEE ALL REVIEWSONLINE SHOPSSort DefaultDefaultPrice - low to highPrice - high to lowNT$350.26スギSUGINT$387.03+NT$288.00 shippingCosmeBear 小熊藥妝台湾站 - 日本藥妝特賣直邮NT$407.00+NT$589.23 shippingJapan With Love",illegal,"該廣告文字內容聲稱「減少腹部脂肪」和「減緩餐後血糖水平上升」。根據參考資料，食品廣告中涉及改變人體生理功能或體態的詞句，如「抑制脂肪組成和吸收」、「促進內臟脂肪燃燒」、「減重/減脂」、「糖切阻糖」、「阻隔糖分」、「阻斷澱粉分解」、「血糖飆升」等，均被認定為涉及誇大療效或易生誤解，違反食品安全衛生管理法第28條第1項規定。

1. **「減少腹部脂肪」**：此詞句直接宣稱產品具有減少特定部位脂肪的功效，與參考資料中「抑制脂肪組成和吸收」、「促進內臟脂肪燃燒」、「減重/減脂」、「有效降酯」等被判定違法的詞句性質相似，均涉及改變身體外觀或生理功能。

2. **「減緩餐後血糖水平上升」**：此詞句直接宣稱產品具有調節血糖水平的功效，與參考資料中「糖切阻糖」、「阻隔糖分」、「阻斷澱粉分解」、「分泌碳水化合物比較少的糖分進入血液而不會導致血糖飆升增加脂肪」等被判定違法的詞句性質相似，均涉及調節人體生理機能，已逾越食品廣告的範疇，涉及醫療效能或誇大。

儘管採用「從寬認定合法性」原則，但上述兩項主要宣稱已明確涉及改變人體生理功能或體態，與參考資料中被判定違法的廣告用詞高度相似，因此判斷為涉及誇大療效及違法。"
