ID,Question,Judge,Reason
25,商品屬性 商品評論 (已有 0 筆商品評論) 退換貨政策 隱私權政策 網站服務條款 Yamoto大和酵素 大和酵素 活動～～ 下單即贈 小林製藥 小白兔暖暖包 1片 滿$2500元贈 大漢酵素 V52蔬果維他植物醱酵液 60ml 1罐 滿$6000贈 中化健康360 倍多喜口含錠 30錠 每筆訂單每個贈品只贈送1次，恕不累贈與更換；送完為止※液體類商品無法寄送海外大和酵素 大和酵素粉末使用方式： 日常保健-每日早晚各食用1包 加強飲用-每日早晚各食用2包 粉末可直接食用或配水食用 &nbsp;給您活力健康每一刻 攜帶容易、食用方便，解決出門在外無法攜帶酵素原液的困擾 降低熱量與糖分，即使有水分限制與糖分限制者也能輕鬆補充 與酵素原液搭配使用，保健效果更顯著 日本大和酵素株式會社沿革 西元1946年4月－ 第一任社長－大和國生（先生）為改善日本國民的健康情形，設立了日本第一家的酵素製造商－「大和酵素普及會」，從事酵素飲料的開發及銷售。 西元1955年8月－ 因業務需求量大增，進而設立「大和酵素株式會社」。 西元1975年4月－ 基於銷售通路的考量，在東京品川設立「大和酵素販售株式會社」。 西元1975年6月－ 基於市場需求的考量，設置「大町工廠」，專門從事酵素產品的製造。 西元1977年6月－ 大阪府泉北郡高月町的工廠成立，以配合業務的擴展及酵素化妝品和藥品部的擴充。 身為酵素產業先驅－大和酵素株式會社從事酵素製品的研究和推廣活動，不僅是為了日本國民亦傾全力促進全世界人類的健康，其後經歷了60餘年的發展，大和酵素株式會社受到許多愛用者的支持至今。除了酵素原液製品之外，也製造了乳酸菌、酵素製劑、酵素化妝品、酵素沐浴劑等150種以上的相關產品，在日本國內2000家以上的藥局、美容沙龍、百貨店等進行銷售。 其他國家的銷售網路部分，系列產品首先行銷於臺灣，亦已大量出口到中國、新加坡、美國、歐洲、韓國等地。 持續研發酵素產品是公司的最大堅持，在鍋谷將藥學博士的帶領之下，大和酵素研發團隊將繼續為全人類的健康而努力。 大和酵素企業商標的涵義 看到大和酵素的企業商標了嗎？ 第二次世界大戰（1939-1945）造成全世界大動盪，大和酵素創辦人 大和國生先生有鑑於戰後日本國民的健康情形大為受創，因此立下改善國民健康的宏願，於1946年成立大和酵素普及會，以促進全民的健康為志業。為了永續創立的初衷，在企業商標的設計上，特意以六個葫蘆所組成－『六瓢』，日文發音同『無病』，分別代表五臟（心、肝、脾、肺、腎）及身體，祈願大和酵素能守護每一位使用者的健康。此企業信念，經過了六十餘年依然如昔，今後必會堅守信念繼續努力，提供更優質的產品 給所有支持大和酵素的愛用者。 產品資訊提供：大和酵素專賣店https://www.yamatoenzyme.com.tw/保健食品主要成份大和酵素原液、日本梅萃取物、維生素C、維生素E容量3公克*30包產品屬性保健食品如果您對本商品有什麼問題或經驗，請在此留下您的意見和建議！ 您的姓名 您的評論注意： 評論內容不支援HTML代碼！ 評價 &nbsp;&nbsp;&nbsp; 差評&nbsp; &nbsp; &nbsp; &nbsp; &nbsp; &nbsp;好評 驗證碼 輸入驗證碼 請輸入今年是民國幾年(數字即可) 繼續退換貨政策： 【退貨申請說明】 依照消費者保護法規定，消費者享有商品到貨7天鑑賞期（包含例假日）之權益，七日鑑賞期屬『考慮期』並非『試用期』。 請注意：商品一經開封、使用，以致缺乏完整性及施區再販售價值時，恕無法辦理退貨，敬請見諒。（商品外包塑膠膜已撕開，即算開封狀態） 收到商品超過7天，恕不接受退貨。 請填妥退貨申請表之姓名、Email、手機號碼、訂單編號及退貨原因等，若使用信用卡以外的方式付款，則需填寫匯款帳號。收到您的退貨申請後，我們立即與您確認退貨相關事宜。 退貨商品皆不可開封，不接受部分退貨，並請依原包裝寄回。退回商品需包含此筆訂單的所有商品+發票（含贈品）等，如未將此筆訂單包裹中的所有內容物妥善包裝、完整寄回，需請您自費郵資補件。 當您的退貨需求通過審核，我們會請宅配人員至您填寫的收件地址取回商品，將由我們負擔此次物流費用。 若選擇超商店取的服務，請將完整商品送至超商使用退貨包裝袋進行退貨。 已使用之優惠券於完成結帳後即不再有效，取消/退貨申請成立後也無法取回優惠券，敬請見諒。 當您提交取消/退貨申請表後，即代表同意我們的退貨原則，並接受我們代為處理發票作廢及相關的後續處理事宜。【退款說明】 若您使用信用卡付款，退貨商品收回並經工作人員確認商品數量無誤後，會進行線上刷退；退款實際入帳日期，依各發卡銀行入帳日不同有所差異，請您洽詢發卡銀行確認實際入帳日。 若您使用其他方式付款，必須請您提供正確的匯款帳號，以利完成退款手續。 確認符合我們的退款標準，且資料確認無誤後，我們10個工作天內會再將款項退到您的帳戶。【無法辦理退貨的情況】 已超過7天猶豫期，恕無法辦理退貨。 欲退貨訂單中任一商品若已開封（例如：外包塑膠膜已撕開或商品塑膠袋已打開、商品已開封使用），即無法辦理退貨。 若退貨商品與訂單有所出入，未將此筆訂單的所有商品+發票（含贈品）等悉數寄回並妥善包裝，將影響您的退貨權益。【無法辦理退款的情況】 匯款帳號填寫有誤，將無法辦理退款。 隨貨寄出之紙本發票，但未寄回發票（客服會連絡您進行發票的補件，補件郵資將請您自行吸收）。 提交退貨申請表後的10個工作天內，若因填寫資料有明顯問題卻無法聯繫到您，將取消您的申請。 若申請退貨商品收回審核後並未符合退貨標準，將無法辦理退款，商品寄回消費者端之運費則由消費者自付。 當我們已安排取件，但宅配人員到訪1次卻無法順利收回商品，將取消您的申請，敬請見諒。再次提醒您... 依《消費者保護法》，消費者享有7天猶豫期之權益（收到商品後隔天起為第一天）。猶豫期非試用期，商品需要全新未開封，且包裝完整的狀態，才能辦理退貨退款。若商品已開封，恕無法辦理退貨退款手續。若已詳閱且確認以上事項您可接受，再請填寫我們的退貨申請表，收到申請後，我們會盡快為您處理退貨退款事宜。 請注意！當您提交退貨申請表後，即代表同意我們的退貨原則，並接受我們代為處理發票作廢及相關的後續處理事宜。若您有其他疑問，歡迎點選本頁右下角的「LINE@ 諮詢客服」，或撥打我們的,legal,該廣告文字內容主要描述產品的使用方式、便利性、公司歷史以及贈品活動。其中提及的「給您活力健康每一刻」及「日常保健」屬於廣泛的健康維護用語，並未涉及具體的疾病治療、預防或改善身體特定機能的宣稱。而「降低熱量與糖分」是針對產品成分的描述，而非誇大療效。與參考資料中被判定違法的廣告用詞（如：思緒調理、幫助入睡、提高抵抗力、滋潤眼睛、減少脂肪吸收、控制體重、改善便秘等具體功能性或療效性詞語）相比，本廣告文字內容並無類似的誇大或涉及醫療效能的宣稱。根據「從寬認定合法性」原則，判斷其為合法。
26,"酵素 - Google Shopping HIBINO 日比野 黃金消化酵素150g罐裝Visit siteNT$2,100.00 · 蝦皮購物Free shippingCOMPARE PRICESPRODUCT DETAILS促進食慾助消化 。 含多種天然酵素、有機酸、水溶性纖維素等。 協助改變改變細菌叢生態,幫助寶寶排便順暢。 讓好菌活力滿滿,維持寶寶消化道機能。 幫助寶寶調整體質,增強體力MORE DETAILSONLINE SHOPSSort DefaultDefaultPrice - low to highPrice - high to lowNT$2,100.00Free shipping蝦皮購物NT$1,512.00Free shippingmomo購物網NT$1,680.00Free shipping媽咪愛",legal,廣告文字內容主要使用「促進」、「協助」、「幫助」、「維持」、「調整」、「增強」等詞彙，描述產品對消化、排便、細菌叢生態、消化道機能、體質及體力的輔助或維持作用。這些詞彙在食品廣告中通常被視為一般性健康維持或機能性訴求，並未直接宣稱具備治療、預防疾病或改善特定病症的醫療效能。與參考案例中涉及「緩解」、「預防跌倒」、「改善視力模糊」、「提升自我防禦力」、「救星」等具體且強烈的醫療或誇大效能詞句相比，本廣告的用詞較為溫和且符合食品廣告的規範範圍。根據「從寬認定合法性」原則，判斷其不涉及誇大療效或違法。
27,【消化酵素是什麼？】 消化酵素是可將食物由大分子分解為小分子，幫助消化，維持消化道機能。 美國n.zimes®高活性綜合消化酵素 世界一流酵素大廠 n.zimes® ► 幫助消化效率大幅提升 ✦ 多元真菌發酵酵素 ► 比一般蔬果酵素效果更好 ✦ 綜合19種超級酵素配方 ► 活性酵素種類多 ✦ 荷蘭 TNO 實驗研究 ►實驗證實大幅提升消化效率 ✦ 保證絕不添加傷身瀉藥成分(番瀉葉、番瀉苷) ✦ 給你大自然的真實，無添加任何化學賦形劑、果汁粉、甜味劑 丹麥Gastro-AD®保衛樂 德式乳桿菌大豆發酵物 ✦ 世界大廠Gastro-AD® ► 緩解飲食後困擾 ✦ 不含西藥、制酸劑 ► 成分天然無副作用 ✦ 具GMP KOSHER HALA安全認證 【消化禮物 商品資訊】 產品名稱：[消化禮物]保衛高活性19種消化酵素 成分：大豆發酵物(非基改大豆、德氏乳桿菌質)、綜合消化酵素(麥芽糊精、澱粉分解酵素、植酸酵素、葡萄糖澱粉酵素RO、複合酵素(含脂肪分解酵素、蛋白質分解酵素、澱粉分解酵素、麥芽糊精)、中性蛋白質分解酵素、鳳梨酵素、蛋白質分解酵素4.5、轉化酵素、蛋白質分解酵素3.0、半纖維素分解酵素、果膠酵素、α-半乳糖苷酶、蛋白質分解酵素AM、脂肪分解酵素、胜肽分解酵素、乳糖分解酵素、蛋白質分解酵素6.0、澱粉酵素、纖維素分解酵素AN)、玉米來源可溶性纖維 膠囊成分：羥丙基甲基纖維素 內容量：560毫克/顆，30顆/盒 食用方式：每日2~4顆，隨餐食用。 保存期限：二年 保存方法：請置於陰涼乾燥處，避免日光直照或高溫潮濕的環境。開封後請將乾燥劑取出並於60天內食用完畢，以保最佳效果。 產地：台灣 過敏原：本產品含大豆製品及麩質之穀物製品。 全素可食,illegal,廣告文字內容中，『緩解飲食後困擾』一詞，『緩解』具有減輕、解除症狀之意，已涉及生理功能之改善，與參考資料中『舒緩情緒』、『緩解課業壓力』等詞句性質相似，皆暗示產品具有特定療效或改善身體不適的功能，易使消費者產生誤解。此外，『成分天然無副作用』一詞，『無副作用』為絕對性之宣稱，任何食品或成分皆無法保證完全無副作用，此類宣稱極易造成誇大不實或引人錯誤之印象，違反食品安全衛生管理法第28條第1項規定，涉及誇大療效及違法。
28,"酵素 - Google Shopping Jyc 極研萃暢快纖酵素錠60錠Visit siteNT$1,490.00 · 屈臣氏網路商店COMPARE PRICESPRODUCT DETAILS詳細介紹 6大消化代謝維持健康、排便順暢。 56種蔬菜、24種水果、10種乳酸菌、日本專利蘋果果膠。 80蔬果酵素 × 乳酸菌 × 綠茶 × 鳳梨酵素 × 日本蘋果果膠 × 大麥草 × 蛋白酵素。 小叮嚀 1. 請置於乾燥陰涼通風處避免陽光照射同時置於孩童無法拿取處。 2. 若正值懷孕、哺乳或藥物治療等情況請洽詢醫師、藥師、營養師之建議請依食用方式使用有助維持健康。 3. 食用方式每日一次每次一粒每日限食用一粒睡前搭配冷溫開水用多食無益。 4. 本品含燕麥片、大麥、芝麻、大豆、黑麥、黑豆、芒果、腰果、核桃、糖、乳酸菌。 本產品投保產品責任險新台幣貳仟萬元。 通過sgs檢驗核可。 專業設備及製程專利成分添加。 技術研究中心創新技術開發。 商品規格 商品簡述 6大消化代謝維持健康、排便順暢 56種蔬菜、24種水果、10種乳酸菌、日本專利蘋果果膠。 品牌 極研萃jyc 規格 60錠 原產地 台灣 深、寬、高 4.5x8.5x13cm 淨重 200 G 保存環境 室溫 是否可門市/超商取貨 Y 商品屬性 投保產品責任險 新台幣貳仟萬元 製造日期 詳見包裝 包裝份量 60錠 食品業者登錄字號 B-200206504-00000-7 藥商許可執照: 藥商諮詢專線:0800-051-148 許可執照字號:北市衛藥販松字第620101c611號 藥商名稱:台灣屈臣氏個人用品商店股份有限公司 藥商地址:台北市松山區八德路四段760號11樓之1、之2及14樓 藥商諮詢專線:(02)27421234MORE DETAILSUSER REVIEWS5.0★★★★★694 reviews54321SEE ALL REVIEWSONLINE SHOPSSort DefaultDefaultPrice - low to highPrice - high to lowNT$1,490.00屈臣氏網路商店NT$1,390.00樂天市場購物網NT$564.00Free shippingCoupang 酷澎NT$1,490.00Free shipping蝦皮購物",legal,"根據廣告文字內容，其主要宣稱「6大消化代謝維持健康、排便順暢」以及「有助維持健康」。與參考資料中的違法案例相比：

1.  **參考資料26 (BHK's 非變性二型膠原蛋白膠囊)**：涉及具體疾病治療或改善效果，如「降低關節疼痛3.4倍」、「修復及重建軟骨」、「減緩關節發炎疼痛」、「抗發炎」等，這些屬於醫療效能的宣稱。
2.  **參考資料29 (康健妍蘋果肌膠原粉)**：涉及誇大美容效果，如「醫美等級」、「蘋果肌」、「逆齡秘訣」、「Q彈水潤」、「提升肌膚彈性及促進膠原蛋白生成」等，這些屬於誇大不實或涉及改變身體外觀的宣稱。
3.  **參考資料24 (葉黃素膠囊)**：涉及具體生理功能改善，如「滋潤」、「幫助循環順暢」、「酸澀」等，這些屬於暗示或宣稱特定器官的治療或改善效果。

對比之下，本廣告的「維持健康」和「排便順暢」屬於食品或保健食品常見的、較為溫和的生理功能宣稱，不涉及疾病治療、誇大美容效果或特定器官的醫療效能。特別是「排便順暢」對於酵素類產品而言，是其成分（如蔬果酵素、乳酸菌、蘋果果膠）可能帶來的合理生理反應，且未宣稱治療便秘等疾病。廣告中也包含「有助維持健康」的字眼，並有「請洽詢醫師、藥師、營養師之建議」等警語，符合一般保健食品的規範。根據「無罪判定原則」及「從寬認定合法性」，此廣告文字內容不涉及誇大療效或違法。"
29,"酵素 - Google Shopping 【大漢酵素】果萃蔬果酵素粉(30入/盒)Visit siteNT$1,242.00 · momo購物網Free shippingCOMPARE PRICESPRODUCT DETAILS外食族神救援! 一天吃不到5色蔬果,那就一包吃進52種豐富自然營養素,滿足健康正能量,一日的蔬果營養,就靠果萃Carry。 52種蔬果鮮萃+啤酒酵母、維他命C、綜合酵素、植化素、Beta胡蘿蔔素、難消化性麥芽糊精-低GI優質水溶性纖維,確實維持消化道健康,蔬果全明星隊,小小一包,營養輕鬆罩!MORE DETAILSUSER REVIEWS5.0★★★★★1 review54321SEE ALL REVIEWSONLINE SHOPSSort DefaultDefaultPrice - low to highPrice - high to lowNT$1,242.00Free shippingmomo購物網NT$1,242.00Free shippingPChome 24h購物",legal,該廣告文字內容主要強調產品提供豐富的營養素（如52種蔬果鮮萃、維他命C、植化素等），以補充日常飲食中可能攝取不足的蔬果營養，並提及「滿足健康正能量」及「確實維持消化道健康」。相較於參考資料中被判定違法的廣告，本廣告並未出現涉及治療、改善、預防疾病或特定生理功能異常的詞句，例如「促進性腺分泌，抗衰老、治禿頭，回復青春」、「強力殺菌的作用，增強免疫系統」、「修復及重建軟骨、減緩關節發炎疼痛、防止軟骨遭侵腐」等具醫療效能的宣稱。廣告中「維持消化道健康」的說法，屬於食品可宣稱的「維持生理機能」範疇，並未誇大至療效層面。根據「無罪判定原則」，從寬認定其合法性，故判斷為合法。
30,🌟 日本Svelty糖脂分解酵素三倍加強版推薦！💪✨ 所有美妹們注意啦！平時的party都在等著我們大吃大喝，但別擔心，有了這款Svelty糖質分解酵母酵素，吃貨們也能輕鬆瘦身啦！這酵母能分解和消化碳水化合物，幫你有效吸收糖和脂肪，吃甜品也不怕啦！🍰🍬和其他酵素不同，它能幫助我們提高新陳代謝，讓燃脂更有效率！💥還能促進消化，潤腸通便，我親測，感覺真的很不錯！❤️這是3倍加強版哦！效果更好更強勁，飯前吃兩粒，真的能控制飯量，堅持吃下去，瘦下來簡直不要太easy！… 在日本減肥排名第一的產品！💪✨ 分解脂肪的利器，范冰冰都親自用過並推薦！🌟🔥 要找到它真的不容易，但為了美，一定要值！💃 有56粒和100粒2個規格可以選擇，主要成分包括殼聚糖，酵母菌，白芸豆提取物等，完全無副作用！👍 減肥當然是為了美麗，但健康更重要！記得選用對身體無害的產品哦！💖 #Svelty糖質分解酵母酵素 #Svelty #絲蓓緹 #分解酵母 #酵素 [使用方法]普通款：建議服用方法：飯後2粒，一天最多4粒 3倍加強版：建議服用方法：午飯後吃2顆，晚飯後吃2顆[原料成分] 普通款：乾燥酵母、幾丁聚糖、白腎豆萃取粉、難消化性麥芽糊精、乳糖、藤黃果萃取粉、燭台草粉末、羞辱草萃取粉、蛇葡萄萃取粉、抹茶、寡糖、烏龍茶萃取粉、麥芽糊精、雙歧桿菌、及麥芽糖醇。 3倍加強版：乾燥酵母、幾丁聚糖、白腎豆萃取粉、難消化性麥芽糊精、乳糖、藤黃果萃取粉、燭台草粉末、羞辱草萃取粉、蛇葡萄萃取粉、抹茶、麥芽糖醇、寡糖、薑黃萃取、烏龍茶萃取、麥芽糊精、雙歧桿菌、科勒斯福斯科利萃取物、黑胡椒萃取物、結晶纖維素、明膠、硬脂酸鈣、二氧化矽、琥珀酸、碳酸鈣。[相關知識]酵母酵素的益处1. 维护血糖稳定：酵母酵素被认为可以帮助分解碳水化合物，这对于控制血糖水平非常重要。通过有效吸收糖分，它有助于维持血糖在正常范围内，这对于那些希望控制体重或需要管理糖尿病的人来说尤为重要。2. 提高新陈代谢：与其他酵素不同，酵母酵素被认为可以促进新陈代谢的正常运行。这意味着它有助于身体更有效地将食物转化为能量，从而有助于维持健康的体重和活力。3. 促进消化和肠道健康：酵母酵素可以帮助促进消化，减少胃肠道不适感。此外，它含有的一些成分可能有助于潤腸通便，帮助维持良好的肠道健康。4. 抗氧化和抗炎作用：酵母酵素中的一些成分，如抹茶和薑黃萃取，被认为具有抗氧化和抗炎特性。这些特性有助于减少自由基损害，维护身体的整体健康。,illegal,廣告文字內容涉及多項誇大療效及易生誤解的違法用詞。首先，產品被宣稱為「酵素」，但廣告中出現「輕鬆瘦身啦！」、「瘦下來簡直不要太easy！」、「分解脂肪的利器」、「控制飯量」等直接或暗示減肥、體重控制及體態改變的詞句，這與參考案例5、13、39中「酵素廋身」、「so身」、「減重」、「窈窕」、「瘦身的效果」、「體重ByeBye」、「身材L變S不是夢」等被認定為誇大易生誤解的用詞高度相似。其次，廣告聲稱「分解和消化碳水化合物，幫你有效吸收糖和脂肪，吃甜品也不怕啦！」（若解讀為減少吸收，則與參考案例5「阻止澱粉吸收」、「吸附一整天的油脂」、「熱量會被阻止吸收」相似；若按字面意思「有效吸收」則與減肥目的相悖，更具誤導性），以及「提高新陳代謝，讓燃脂更有效率！」等，這些都屬於對食品生理功能或作用機轉的誇大宣稱，與參考案例5、13、39中「吸附一整天的油脂」、「阻止澱粉吸收」、「提升脂肪分解率」、「提高代謝瘦方案」等違規內容一致。此外，「促進消化，潤腸通便」也與參考案例5、39中「帶走廢物」、「排出廢物，讓身體越來越輕盈」、「排毒代謝」等宣稱消化排泄功能相似。廣告中「吃甜品也不怕啦！」、「飯前吃兩粒，真的能控制飯量」暗示無需節食或可輕鬆控制飲食，這與參考案例5、13、39中「不用節食」、「沒在忌口」、「吃大餐也不怕胖」、「消除飢餓感」、「減少進食的慾望」等違規內容相符。最後，「在日本減肥排名第一的產品！」、「3倍加強版哦！效果更好更強勁」屬於誇大產品效能及排名，而「完全無副作用！」則為不實的安全保證，這些都與食品廣告的規範不符。綜合判斷，該廣告文字內容已超出食品應有的宣稱範圍，涉及誇大療效及易生誤解，構成違法。
31,商品名稱：大漢酵素綜合蔬果醱酵液容量規格：720mlx1瓶成份來源：蔬果醱酵液(鳳梨、番薯、甜瓜、檸檬、番茄、番石榴、南瓜、青花菜、蘋果、小黃瓜、葡萄、楊桃、芥菜、黃豆、甜椒、西瓜、木瓜、蘿蔔、馬鈴薯、萵苣、花椰菜、梅子、胡蘿蔔、小白菜、哈密瓜、芹菜、黃瓜、蕪菁、隼人瓜、胡瓜、山藥、甘藍、空心菜、芥藍、瓠瓜、葡萄柚、金桔、絲瓜、生薑、菠菜、番薯葉、水梨、蓮霧、青椒、青江菜、苦瓜、小松菜、冬瓜、酪梨、印度棗、木薯、蘆筍、甜菜根、諾麗果、黑木耳、豆瓣菜、紅鳳菜、百香果、枇杷、釋迦、柳橙、龍眼、芒果、蓮藕、芋頭、火龍果、紫蘇、荔枝、香菇、金針菇、柿子、白菜、李子、奇異果、茄子、柑橘、玉米、桑椹、草莓、紅豆、豌豆、牛蒡、甘蔗、蘆薈、櫻桃、蓮子、藍莓、菜豆)。原產地(國)：台灣製造廠商或國內負責廠商名稱：大漢酵素生物科技股份有限公司製造廠商或國內負責廠商地址：新北市板橋區四川路二段16巷10號10樓製造廠商或國內負責廠商電話：02-89669671使用方法：每天使用1~3次，每次30毫升，以5-8倍的冷水或溫水稀釋飲用，冰涼飲用風味更佳,legal,廣告文字內容僅包含商品名稱、容量規格、成份來源、原產地、製造廠商資訊及使用方法，未提及任何涉及療效、保健功效、疾病預防或治療等誇大或易生誤解之詞句。與參考資料中因宣稱醫療效能或誇大功效而違法的案例不同，本廣告內容屬於食品的一般性資訊揭露，符合無罪判定原則，從寬認定為合法。
32,"酵素 - Google Shopping 消化綜合酵素膠囊Visit siteNT$1,690.00 · LAC TaiwanCOMPARE PRICESPRODUCT DETAILSForm: CapsuleSupplement Ingredient: ProbioticsType: SupplementsAge Group: Adult專利酵素加乳酸菌複合配方,有效幫助食物消化、分解。 複合酵素配方-三大營養素消化酶。 專利 Digeseb & Hemiseb -含醣類、纖維分解酶。 乳酸菌證實具高生理利用率,能有效在人體作用,維持健康。 多種消化酵素可幫助食物分解成小分子,有助於三大營養素的吸收,幫助消化。 植酸酶能分解植酸(如:大豆、大麥及全穀類),消化酵素能提升消化機能,減輕負擔。 特殊纖維酶能幫助纖維分解,使食物更容易被消化利用。 奶素食者可食。MORE DETAILSUSER REVIEWS5.0★★★★★1 review54321SEE ALL REVIEWSONLINE SHOPSNT$1,690.00LAC Taiwan",legal,廣告文字內容主要描述酵素和乳酸菌幫助食物消化、分解、吸收營養素，以及提升消化機能、減輕負擔等功能。這些描述符合消化酵素和益生菌作為食品補充劑的常見功能性宣稱，並未提及治療、預防特定疾病或改善特定身體症狀（如過敏、牙周病、私密處問題等），也未出現誇大或量化的療效宣稱（如「救星」、「拒絕乾癢」、「排便3週順暢3.3倍」等）。與參考資料中被判定違法的案例相比，本廣告的用詞更為保守，僅限於幫助消化和維持健康的一般性描述，未涉及誇大療效或暗示醫療效能，因此根據「無罪判定原則」從寬認定為合法。
