ID,Question,Judge,Reason
53,"美白 - Google Shopping 肌研 白潤美白化粧水 170mlVisit siteNT$440.00 · 屈臣氏網路商店COMPARE PRICESPRODUCT DETAILSSkin Type: For All Skin TypesIngredient: Vitamin C, Hyaluronic AcidForm: CreamSkin Problem: Hyperpigmentation詳細介紹 2024肌研白潤美白化粧水(清爽型) 170ml Hada-labo Shirojyun Lotion 肌研白潤系列—對肌膚美白潤澤的極度堅持 嚴選日本厚生省核准有效美白成分傳明酸能抑制黑色素生成改善暗沉及膚色不均問題搭配雙重薏仁精華和水解玻尿酸調理肌膚乾燥粗糙重現充滿透明感的白皙美肌。 肌研 白潤美白化粧水(清爽型) 170ml 傳明酸 具卓越滲透力的美白成分能直達斑點根源抑制黑色素從源頭全面阻斷黑斑生成 -維他命c誘導體x維他命e有效淡化黑色素改善暗沉 -雙重玻尿酸配合美白同時保濕 -輕透水感質地油肌/混合肌也能感受清爽不黏膩的膚觸 -溫和弱酸性無添加香料、色素、礦物油、酒精 肌研是日本樂敦製藥研究中心研發的肌膚保養品牌。 本著perfect、Simple的理念嚴選對肌膚真正有效及有益的成分以製藥標準打造高品質產品帶給消費者安全無虞的信心美肌。 品名肌研白潤美白化粧水清爽型170ml 用途美白、保濕肌膚 用法1. 取適量於手心塗抹全臉以雙手包覆臉頰透過掌溫幫助吸收 2. 手掌輕壓臉頰感受肌膚水潤彈力 使用",legal,"根據提供的廣告文字內容與參考資料進行比對，該廣告用詞並未涉及誇大療效或違法。主要判斷依據如下：

1.  **美白與淡化色素：** 廣告中提及「美白」、「抑制黑色素生成」、「改善暗沉及膚色不均問題」、「淡化黑色素」等詞彙，這些是化粧品常見且合法的宣稱範圍，旨在改善肌膚外觀。參考資料中被判為違法的案例，多涉及「消除」、「擊潰」、「去除」等更為絕對或具醫療效果的詞彙（例如：『消除痘印』、『擊潰黑斑』、『除斑』），而本廣告使用的是「抑制生成」和「淡化」，屬於化粧品可宣稱的範疇。

2.  **「阻斷黑斑生成」的解讀：** 廣告中「能直達斑點根源抑制黑色素從源頭全面阻斷黑斑生成」一句，雖然「阻斷」聽起來較強，但其後緊接「生成」，表示是針對黑色素的『形成過程』進行抑制或阻斷，而非宣稱能『消除』或『治療』已存在的斑點。這與參考資料中被判違法的「消除斑點疤痕」或「擊退白髮」等詞語有本質上的區別，後者暗示了對既有問題的根治或逆轉，而「阻斷生成」則偏向預防或抑制新問題的發生，屬於化粧品可宣稱的範疇。

3.  **無醫美或醫療級宣稱：** 廣告中沒有出現「醫學級」、「媲美醫美」、「醫美療程」、「修復受損肌膚」、「刺激膠原蛋白增生」等涉及醫療行為或暗示醫療效果的詞彙，這與參考資料中多個被判違法的案例形成對比。

4.  **其他詞彙：** 「調理肌膚乾燥粗糙」、「重現充滿透明感的白皙美肌」、「清爽不黏膩的膚觸」、「溫和弱酸性無添加香料、色素、礦物油、酒精」等，均屬於化粧品常見的質地、使用感受或成分特性描述，不涉及誇大療效。

綜合以上分析，並根據「從寬認定合法性」的原則，該廣告文字內容未超出化粧品應有的宣稱範圍，不涉及誇大療效或違法。"
54,高光美白精華 60ml - UNA 網站主選單 輸入手機下載官方 APP，購物更便利 免費傳送載點至手機 訂單查詢 會員專區 我的收藏 我的優惠券 會員登出 會員登入/註冊 0 最新加入項目 點＋ 點 加價購 結帳 購物車內目前沒有商品 語系 幣別 商品分類 商品分類 首頁 臉部保養 質地 精華液 | 精華油 首頁 商品分類 所有分類 本商品適用活動 看更多 電子票券 NFT 限定地區活動 獨享 點數兌換商品 APP獨享活動 限定商品 定期購商品 買就送 贈品 查看贈品 加價購商品 國家/地區配送 &nbsp;( ) 付款完成後將發送電子票券至「會員專區 &gt; 我的票券」，需至門市出示憑證掃碼兌換 付款完成後將發送 NFT 至「會員專區 &gt; 我的 NFT收藏」 更多使用說明 商品將在 開賣！ 購買名單 ※ 購物滿，才可購買本商品 ※ 本商品不適用折價券 ※ 本商品不適用點數折抵 ※ 付款與運送,legal,廣告文字內容主要為網站導覽、購物功能及產品類別描述，其中「高光美白精華」為產品名稱，其「美白」功效屬於化粧品常見之訴求，旨在改善膚色亮度或均勻度。對比參考資料中的違法案例，其廣告用詞涉及明確的醫療效能（如鎮靜、抗菌、預防感染、舒緩更年期不適、改變菌叢生態）、生理功能改變（如緊緻、敏感度提升、解決私密困擾、除皺、擊退頑固斑點、抑制色素等），甚至提及身體內部部位或具體數字效果。本廣告文字中並無類似誇大、涉及醫療效能或具體治療效果的描述。根據「無罪判定原則」及「從寬認定合法性」原則，此廣告用詞未涉及誇大療效或違法。
55,"美白 - Google Shopping 雪芙蘭 SUPER EX超能全效美白激亮精華乳 330g 1條Visit siteNT$199.00 · 屈臣氏網路商店COMPARE PRICESPRODUCT DETAILS全效美白激亮 美白EX進階,淡斑撫紋 超能明星”雪肌肽”富含美白九胜肽+AA2G+維他命B3,全方位阻斷黑化路徑,全面淡化斑點,撫平身體紋路。 超能10X*菸鹼醯胺,改善色差 添加10倍”菸鹼醯胺”,加倍提升亮白效能,快速白皙改善黯沉,減緩黑色素生成,使肌膚由裡而外勻亮淨白。 2大超能美白成分,明顯亮白 2大超能美白成分α -熊果素、傳明酸「添加至有效濃度」,確實改善表淺斑點黑色素沉澱,明顯提亮膚色,讓肌膚白皙無瑕更顯光澤。 SUPER 100倍 維他命c,重磅美白力 100倍維他命C的超級果實“卡卡杜李”+重量級美白成分“穀胱甘肽”,改善肌膚色差不均的困擾,針對黯沉肌膚,更快速提亮膚色。 果酸煥膚勻亮 煥膚EX進階,勻嫩亮白 添加10倍“亮白紅石榴”的驚人亮白力,快速改善肌膚黯黃粗糙,速效提高白皙細緻感,呈現無瑕透亮肌。 7X果酸,極效煥膚 7X果酸『水楊酸、琥珀酸、乳酸鈉、甘醇酸、檸檬酸鈉、蘋果酸、酒石酸』促進老廢角質代謝,改善手臂大腿毛囊角化,平滑膚觸並改善粗糙感。 2大超能美白成分,明顯亮白 2大超能美白成分α-熊果素、傳明酸「添加至有感濃度MORE DETAILSUSER REVIEWS5.0★★★★★296 reviews54321SEE ALL REVIEWSONLINE SHOPSSort DefaultDefaultPrice - low to highPrice - high to lowNT$199.00屈臣氏網路商店NT$177.00+NT$75.00 shippingmomo購物網NT$209.00+NT$80.00 shippingPChome 24h購物NT$189.00蝦皮購物NT$229.00樂天市場購物網",illegal,"根據參考資料，廣告文字內容中的部分詞句可能涉及誇大療效或宣稱醫療效能，違反《化粧品衛生安全管理法》第10條第1項之規定。

1.  **「撫平身體紋路」**：此詞句與參考資料4中「抗皺」、「減少皺紋」等被判定為誇大的詞句性質相似。化粧品通常僅能宣稱改善外觀、使肌膚平滑，但「撫平紋路」可能被解讀為具有治療或改變肌膚結構的功效。
2.  **「全方位阻斷黑化路徑」** 及 **「減緩黑色素生成」**：這些詞句與參考資料13中「避免黑色素加深」等被判定為誇大的詞句類似。化粧品的美白宣稱應著重於改善膚色不均、提亮膚色等外觀效果，而「阻斷黑化路徑」或「減緩黑色素生成」則可能被視為宣稱影響生理機制或具有醫療效能。"
56,"美白 - Google Shopping Meishoku Whitening Eye Cream 30gVisit siteNT$460.08 + tax · eBay - japansalehouseCOMPARE PRICESPRODUCT DETAILSSkin Type: For Dry SkinIngredient: Vitamin E, Beeswax, Hyaluronic AcidBenefit: Anti-ageing, Melanin ReductionForm: CreamFeatures: Alcohol-freeA medicated eye cream that combines whitening and anti-aging care with a special concentration of placenta. Placenta, a medicated whitening ingredient, penetrates deep into the skin and suppresses melanin production, resulting in clear, blemish-free skin. Ingredients such as collagen and pearl barley extract target areas of concern around the eyes and mouth. It gives firmness and moisture to the skin, leading to plump and firm skin. For the eyes and wrinkle lines. Contains a luxurious blend of domestic placenta, you can take care of wrinkles and blemishes just by applying it. Medicinal whitening effect suppresses melanin production and prevents age spots. Makes fine lines and wrinkles caused by dryness less noticeable, leading to firmer, firmer skin. Special white floral scent. How to use: After preparing your skin with lotion or cream, take an appropriate amount on your fingertips and gently apply it to your skin. In addition to the eye area, please use it on areas of concern such as horay lines.This medicated eye cream offers both skin brightening and anti-aging care. The placenta extract prevents melanin production, while collagen and Job's Tears extract improve elasticity, hydrate and firm skin.MORE DETAILSUSER REVIEWS4.8★★★★★1,641 reviews54321SEE ALL REVIEWSONLINE SHOPSSort DefaultDefaultPrice - low to highPrice - high to lowNT$460.08 + taxeBay - japansalehouseNT$687.18 + tax+NT$818.07 shippingGoods Of JapanNT$256.87 + taxDokodemoNT$448.30 + tax+NT$818.07 shippingsasa.comNT$981.36 + tax+NT$654.13 shippingGoSupps.com",illegal,"廣告文字中提及「A medicated eye cream」及「Placenta, a medicated whitening ingredient」，在台灣化粧品法規中，化粧品不得宣稱具醫療效能或藥用功能。此外，「suppresses melanin production」（抑制黑色素生成）此詞句描述了對生理機能的影響，已超出化粧品僅能改善外觀的範疇，涉及誇大療效。參考資料13及4中，類似的詞句如「避免黑色素加深」、「預防暗黑色素聚集」、「淡化斑點」等，皆被認定為誇大不實，違反化粧品衛生安全管理法第10條第1項規定。因此，該廣告用詞涉及誇大療效及違法。"
57,"美白 - Google Shopping MEDI-PEEL Melanon x Drop Gel Cream 50gVisit siteNT$460.74 + tax · eBay - yaocosCOMPARE PRICESPRODUCT DETAILSIngredient: Retinol, Urea, Vitamin E, Shea Butter, Vitamin C, Biotin, Ceramides, Hyaluronic Acid, Niacinamide, PanthenolMedi-Peel Melanon X Drop Gel Cream is your new go-to solution for achieving a brighter and more even complexion. This innovative gel cream effortlessly fuses the benefits of skincare and pigmentation care, helping to rejuvenate your skin. With a unique formulation, it targets dark spots and uneven tone, giving your skin that radiant glow you desire. This lightweight gel cream is perfect for daily use, easily absorbing into your skin without leaving any greasy residue. Medi-Peel has crafted this product to provide long-lasting hydration while working to diminish the appearance of hyperpigmentation and age spots. Enjoy the refreshing feel as it glides on and penetrates deeply for effective results. Make Medi-Peel Melanon X Drop Gel Cream an essential part of your skincare routine. With consistent use, you'll notice a transformation in your skin's texture and tone. Embrace a luminous complexion that showcases your natural beauty, and let this gel cream bring out the best in your skin. Experience the confidence that comes with healthier, radiant skin today.MORE DETAILSUSER REVIEWS4.7★★★★★1,082 reviews54321SEE ALL REVIEWSONLINE SHOPSSort DefaultDefaultPrice - low to highPrice - high to lowNT$460.74 + taxeBay - yaocosNT$1,469.91 + tax+NT$163.29 shippingDealsbyPalms",legal,根據「無罪判定原則」及「從寬認定合法性」的原則，分析廣告文字內容，其使用的詞彙如「美白」、「brighter and more even complexion」（更明亮均勻的膚色）、「pigmentation care」（色素護理）及「rejuvenate your skin」（使肌膚煥發活力），皆屬於化粧品常見的宣稱效果，旨在改善肌膚外觀。這些詞彙並未涉及誇大療效，也未宣稱具有改變生理機能、治療疾病、或與醫療行為（如促進膠原蛋白增生、啟動肌膚再生機制、醫療級、媲美醫美療程、修復受損肌膚、淡化斑點至治療程度等）相關的功效。與參考資料中被判定違法的案例相比，本廣告內容沒有出現類似「擊退白髮」、「回復黑髮」、「促進肌膚膠原蛋白的生長」、「啟動肌膚再生機制」、「淡化斑點（暗示治療效果）」、「醫療級」、「媲美醫美等級」、「像幫自己在家做了溫和的鳳凰電波」、「像幫肌膚做皮秒雷射」等涉及生理功能改變或醫療行為的誇大宣稱。因此，判斷此廣告文字內容不涉及誇大療效及違法。
58,"美白 - Google Shopping HADALABO 肌研 白潤PREMIUM淨白乳液 140ml 1瓶Visit siteNT$703.00 · iHerbCOMPARE PRICESPRODUCT DETAILSIngredient: Vitamin E, Vitamin C, Hyaluronic Acid, NiacinamideBenefit: Anti-ageing, Melanin ReductionSkin Type: For Dry Skin, For Combination SkinContainer Type: BottleForm: Serum提亮肌膚。 均勻膚色。 含 α-熊果苷,這是一種從熊果植物中發現的天然抗氧劑和皮膚光亮劑,可防止皮膚色素沉著、黑斑和雀斑。 與其他皮膚光亮劑相比,它可以更安心優效地減少黑色素的形成。 在煙醯胺、維生素 C 和 2 種透明質酸的幫助下,其效果進一步加強。 使用 Shirojyun 高級潔白洗面乳潔面後,塗抹 Shirojyun 高級潔白洗面乳。MORE DETAILSUSER REVIEWS4.7★★★★★256 reviews54321SEE ALL REVIEWSONLINE SHOPSSort DefaultDefaultPrice - low to highPrice - high to lowNT$703.00iHerbNT$255.00+NT$60.00 shipping蝦皮購物NT$420.00+NT$80.00 shippingPChome 24h購物NT$315.00+NT$589.23 shippingJapan With LoveNT$209.00Free shippingCoupang 酷澎Showing results 1&ndash;5 of 6Next >",legal,廣告文字內容主要描述產品的美容效果，如提亮肌膚、均勻膚色、減少黑色素形成，並提及成分α-熊果苷可防止皮膚色素沉著、黑斑和雀斑。與參考資料中被判定為違法的廣告用詞（如「消除痘印」、「醫學級」、「促進膠原蛋白生長」、「啟動肌膚再生機制」、「擊退白髮」等涉及醫療效能、生理機能改變或誇大療效的詞句）相比，本廣告的用詞較為溫和，未直接宣稱治療、治癒疾病或改變身體生理機能。雖然「防止皮膚色素沉著、黑斑和雀斑」可能略顯強烈，但在化粧品語境下，若產品成分確實能抑制黑色素生成，則可解釋為預防新的色素沉澱或現有斑點加深，屬於化粧品可宣稱的範疇。根據「無罪判定原則」及「從寬認定合法性」，此廣告文字內容不構成誇大療效或違法。
59,"美白 - Google Shopping SOS NATURAL絲萃那 天使純淨美白霜 30ml 台灣製造 外銷品牌Visit siteNT$699.00 · 蝦皮購物COMPARE PRICESPRODUCT DETAILS「抗老X美白X護膚X緊實」 (1)火龍果果實萃取:富含豐富的有機酸,β-胡蘿蔔素,維生素B2 ,C ,菸酸及多種礦物質,幫助肌膚維持健康狀態與白皙 (2)楔基海帶萃取:強化保護力,豐富滋養、保濕賦活,能平衡調理,舒緩肌膚不適感。 (3)黃細心根萃取:抗老化,可讓肌膚達到修護效果,同時提升肌膚的明亮和緊實。 (4)德國洋甘菊:具有舒緩的特殊香氣,並能減輕不適感。 (5)傳明酸:衛福部公告之化粧品美白成分,添加法定含量數2.87%(最高限制3%),能有效抑制黑色素活性,阻礙黑色素製造的能力,讓肌膚不再暗沉,更加白皙透亮,美白有感,暗沉不再。 (6)玻尿酸鈉: 肌膚的補水器,小分子提供吸水續航力,大分子提供補水高效力保濕。 【使用方式】 (1) 全膚質適用。 (2)早晚護膚水及精華液後,適量塗全臉皮膚到頸部。 [5]保養使用步驟: 卸妝→化妝水→精華液→乳液→美白霜。 【容量】30ml 【適用肌膚】一般膚質。 【保存方式】請置於陰暗乾燥處,避免陽光直射,並存放於室內。 【出廠日期】見瓶身 (西元年/月/日) 【保存期限】三年 【SOS NATURAL絲萃那】 - 全球第一個專為皮膚急性症狀設計的救急配方品牌全方位考慮各種不同皮膚的需求,多種成分皆通過歐盟ECOCERT天然有機認證,即效、低敏、專業、自然。 - 堅持採用高品質成分做為基礎原料,持續引進、應用與學習最新原料資訊 - 多年的美妝護膚品生產經驗,擁有先進的技術與製程,提供最專業的服務 - 從原料、瓶器、包裝、代客送檢,與眾多廠家合作,提供客戶完整的服務 【",legal,"廣告文字內容主要描述產品成分的特性及其在肌膚上的美容效果，例如「抗老X美白X護膚X緊實」、「幫助肌膚維持健康狀態與白皙」、「強化保護力,豐富滋養、保濕賦活」、「抗老化,可讓肌膚達到修護效果,同時提升肌膚的明亮和緊實」、「舒緩」、「補水器,保濕」等，這些均屬於化粧品常見的效能宣稱範圍。

特別是針對傳明酸的描述：「衛福部公告之化粧品美白成分,添加法定含量數2.87%(最高限制3%),能有效抑制黑色素活性,阻礙黑色素製造的能力,讓肌膚不再暗沉,更加白皙透亮,美白有感,暗沉不再。」此段文字說明了傳明酸作為衛福部公告的美白成分，其作用機制（抑制黑色素活性、阻礙黑色素製造）以及預期的美容效果（不再暗沉、白皙透亮、美白有感）。這些描述符合化粧品宣稱美白效果的範疇，且未超出其作用機制。

與參考資料相比：
- 參考資料4（台灣奇士美）的違規點在於宣稱具體「減少皺紋百分比」或「改善黑眼圈」等涉及醫療效能或誇大數據的詞句。本廣告未出現此類具體數據或醫療效能宣稱。
- 參考資料29（康定股份有限公司）為食品廣告，其違規點在於宣稱「醫美等級」、「促進膠原蛋白生成」等涉及醫療效能或誇大不實的詞句。本廣告為化粧品，且未宣稱「醫美等級」或「促進膠原蛋白生成」等詞句。
- 參考資料13（富麗佳人企業）的違規點在於宣稱「促進肌膚膠原蛋白的生長」、「啟動肌膚再生機制」、「淡化斑點」、「醫療級」、「消炎鎮靜」等涉及生理機能改變或醫療效能的詞句。本廣告未宣稱「促進膠原蛋白的生長」、「啟動肌膚再生機制」、「淡化斑點」（僅稱「抑制黑色素活性,阻礙黑色素製造的能力」及「白皙透亮」，此為美白成分的機制與效果，非治療斑點）、「醫療級」或「消炎鎮靜」。

綜合判斷，本廣告文字內容在「無罪判定原則」下，其用詞雖有強調效果，但未涉及誇大療效或違反化粧品衛生安全管理法之規定，屬於化粧品可宣稱的美容範疇。"
60,"美白 - Google Shopping Melano CC 高浸透維他命C美白乳液120mlVisit siteNT$359.00 · 屈臣氏網路商店COMPARE PRICESPRODUCT DETAILS詳細介紹 Melano CC高浸透維他命C美白乳液 每日的美白對策 持續型維他命C誘導體配合,能深入肌底改善暗沉,同時使肌膚水潤保濕,實現由內而外散發光彩的透明感美肌 1、添加日本厚生省核准有效美白成分「持續型維他命C誘導體」 2、日本厚生省核准有效肌膚調理成分「甘草酸二鉀」(舒緩修護) 3、添加檸檬及葡萄柚精華,散發清新柑橘香 用途美白淡斑 用法早晚洗完臉後取適量於掌心塗抹於全臉並輕拍幫助吸收。",legal,"The advertisement uses terms like '美白淡斑' (whitening and fading spots) and '深入肌底改善暗沉' (deeply improve dullness), which are generally considered acceptable cosmetic claims for improving skin appearance, implying lightening or reducing visibility rather than complete elimination or cure. It also states the inclusion of '日本厚生省核准有效美白成分「持續型維他命C誘導體」' (Japan Ministry of Health, Labour and Welfare approved effective whitening ingredient), which is a factual claim about an ingredient's regulatory status and approved efficacy, not an exaggerated claim about the product's overall 'cure' or 'medical' effect. Unlike the reference cases that were deemed illegal, this advertisement does not use terms such as '消除' (eliminate/remove), '擊潰' (defeat/crush), '醫學級' (medical grade), specific quantifiable percentages of improvement, or direct comparisons to medical procedures (e.g., '媲美醫美等級', '皮秒雷射'). While Reference 2 cited a different Melano CC product for '直擊黑色素根源' as exaggerated, the current ad's phrasing '深入肌底改善暗沉' is less aggressive. Based on the principle of '從寬認定合法性' (broad interpretation for legality), the current advertisement's wording does not appear to involve exaggerated therapeutic claims or violate regulations."
